{
  "byte_count": 3566,
  "codepoint_count": 359,
  "document_id": "d_NECEAFOILLKNPNDNHKKEEFODFONDOJBGKDDMCCGM",
  "extraction_state": "accepted",
  "input_kind": "text_pdf",
  "locator_count": 2,
  "media_type": "application/pdf",
  "normalization_name": "unicode-nfc-canonical-newline",
  "normalization_version": "1.0.0",
  "normalized_sha256": "c49c0108901ff0be26a81f749d11cfd5d1c0ca5a0cb1a065691912680ef17762",
  "original_sha256": "dd598f6127e24836e0a77a45aeb474802436b99aff0d4b02dc51795aceb5de4a",
  "pack_id": "p_FHHPBOKACIDLDAIBONDFMFFMMLJKPCALIKADGGED",
  "parser_name": "pypdf",
  "parser_version": "6.10.0",
  "schema_version": "lumi.source-document.v1",
  "source_version": 1,
  "warning_codes": []
}
